{
  "SchemaVersion": "1.1",
  "ToolVersion": "3.0.0",
  "Artifact": {
    "FileName": "NPU_RAI_376_WHQL.zip",
    "Sha256": "aa836cbfcad5d0782c79b58f197aa50624af37e7cb8311c5f94d85b0dc3ccaad",
    "Length": 26936876,
    "Format": "zip",
    "EvidenceLevel": "PayloadObserved"
  },
  "Summary": {
    "FileCount": 102,
    "InfCount": 1,
    "InstallerCount": 1,
    "DriverBinaryCount": 1,
    "DriverVersions": [
      "32.00.20101.3760"
    ],
    "HardwareIds": [
      "PCI\\VEN_1022&DEV_1502",
      "PCI\\VEN_1022&DEV_17F0"
    ]
  },
  "Infs": [
    {
      "Path": "c0001/npu_mcdm_stack_prod/kipudrv.inf",
      "Sha256": "c2a448340a9e802faa81b7c03fda0009d52cbfe86be5e915134dac39ab9c8008",
      "Version": {
        "Class": "ComputeAccelerator",
        "ClassGuid": "{F01A9D53-3FF6-48D2-9F97-C8A7004BE10C}",
        "PnpLockdown": "1",
        "DriverVerRaw": "04/04/2026,32.00.20101.3760",
        "DriverDate": "04/04/2026",
        "DriverVersion": "32.00.20101.3760",
        "CatalogFile": "kipudrv.cat"
      },
      "Manufacturer": [
        {
          "Token": "%ManufacturerName%",
          "ModelsSection": "IpuMcdmDriver.Mfg",
          "TargetOSVersions": [
            "NTamd64.10.0...22000"
          ]
        }
      ],
      "TargetOSVersions": [
        {
          "Raw": "NTamd64.10.0...22000",
          "Architecture": "amd64",
          "OSMajorVersion": 10,
          "OSMinorVersion": 0,
          "ProductType": null,
          "SuiteMask": null,
          "BuildNumber": 22000,
          "ParseStatus": "Parsed"
        }
      ],
      "Models": [
        {
          "DescriptionToken": "%IpuMcdmDriver%",
          "InstallSection": "IpuMcdmDriver",
          "HardwareId": "PCI\\VEN_1022&DEV_1502",
          "ModelsSection": "IpuMcdmDriver.Mfg.NTamd64.10.0...22000",
          "TargetOSVersion": "NTamd64.10.0...22000"
        },
        {
          "DescriptionToken": "%IpuMcdmDriver%",
          "InstallSection": "IpuMcdmDriver",
          "HardwareId": "PCI\\VEN_1022&DEV_17F0",
          "ModelsSection": "IpuMcdmDriver.Mfg.NTamd64.10.0...22000",
          "TargetOSVersion": "NTamd64.10.0...22000"
        }
      ],
      "UniqueHardwareIds": [
        "PCI\\VEN_1022&DEV_1502",
        "PCI\\VEN_1022&DEV_17F0"
      ],
      "ServiceBinaries": [
        "%13%\\ipustack.sys"
      ],
      "Includes": [
        "machine.inf"
      ],
      "Needs": [
        "PciD3ColdSupported.HW"
      ],
      "WdfDirectives": [],
      "ProductTypeAssignmentObserved": false,
      "ServerProjection": [
        {
          "TargetOSVersion": "NTamd64.10.0...22000",
          "Server": "Windows Server 2016",
          "Build": 14393,
          "ProductType": 3,
          "Status": "RejectedBuildFloor",
          "Reason": "OS build 14393 is below selector build floor 22000.",
          "EvidenceLevel": "Analysis"
        },
        {
          "TargetOSVersion": "NTamd64.10.0...22000",
          "Server": "Windows Server 2019",
          "Build": 17763,
          "ProductType": 3,
          "Status": "RejectedBuildFloor",
          "Reason": "OS build 17763 is below selector build floor 22000.",
          "EvidenceLevel": "Analysis"
        },
        {
          "TargetOSVersion": "NTamd64.10.0...22000",
          "Server": "Windows Server 2022",
          "Build": 20348,
          "ProductType": 3,
          "Status": "RejectedBuildFloor",
          "Reason": "OS build 20348 is below selector build floor 22000.",
          "EvidenceLevel": "Analysis"
        },
        {
          "TargetOSVersion": "NTamd64.10.0...22000",
          "Server": "Windows Server 2025",
          "Build": 26100,
          "ProductType": 3,
          "Status": "Candidate",
          "Reason": "Selector does not exclude this server profile.",
          "EvidenceLevel": "Analysis"
        }
      ],
      "EvidenceLevel": "PayloadObserved"
    }
  ],
  "Installers": [
    {
      "Path": "c0001/npu_sw_installer.exe",
      "Sha256": "96dc03e574e9dfb2c45543833d8a66d5bcecb9af48e9beac07ea72cccf3ce755",
      "ContractStatus": "ExactHashMatched",
      "ExactHashContract": {
        "ContractId": "npu-smart-installer-96dc03e574e9",
        "RoutingSemanticId": "amd-npu-smart-installer-routing-v1",
        "EvidenceLevel": "StaticDisassemblyProven",
        "AnalysisStatus": "Initial reverse engineering; exact-hash contract; recovered routing semantics v1",
        "DeviceMatcher": {
          "regex": "PCI\\\\VEN_1022&DEV_(1502|17F0)",
          "deviceIds": [
            "1502",
            "17F0"
          ],
          "revisionDiscriminatorObserved": false,
          "revisionStatement": "No REV_ selector was observed in ASCII strings or the recovered device matcher. This does not prove that revision is unused in every code path."
        },
        "PlatformFamilies": [
          {
            "deviceId": "1502",
            "installerLabel": "PHX",
            "researchInterpretation": "Phoenix / Hawk Point family"
          },
          {
            "deviceId": "17F0",
            "installerLabel": "STX",
            "researchInterpretation": "Strix / Krackan family"
          }
        ],
        "OsGates": [
          {
            "condition": "major != 10",
            "action": "Other/unknown path",
            "confidence": "High"
          },
          {
            "condition": "major == 10 and build >= 26100",
            "action": "Install MCDM driver",
            "confidence": "High"
          },
          {
            "condition": "major == 10 and 22621 <= build < 26100 and UBR >= 3527",
            "action": "Install MCDM driver",
            "confidence": "High"
          },
          {
            "condition": "major == 10 and 22621 <= build < 26100 and UBR < 3527",
            "action": "Install WDF/NULL driver",
            "confidence": "High"
          },
          {
            "condition": "major == 10 and 22000 <= build < 22621",
            "action": "Install WDF/NULL driver",
            "confidence": "High"
          },
          {
            "condition": "major == 10 and build < 22000",
            "action": "Windows 10 path / WDF-NULL path",
            "confidence": "Medium"
          }
        ],
        "DriverPaths": [
          "npu_mcdm_stack_prod\\kipudrv.inf",
          "npu_wdf_stack_prod\\kipudrv\\kipudrv.inf"
        ],
        "DriverPathPresence": [
          {
            "Path": "npu_mcdm_stack_prod\\kipudrv.inf",
            "Present": false
          },
          {
            "Path": "npu_wdf_stack_prod\\kipudrv\\kipudrv.inf",
            "Present": false
          }
        ],
        "ObservedApiFamilies": [
          "SetupAPI",
          "CfgMgr32",
          "NewDev/DiInstallDriverA",
          "Registry",
          "WMI"
        ],
        "MissingRequiredStringEvidence": []
      },
      "InterestingStrings": [
        "DiInstallDriverA",
        "Installing MCDM driver from %s...",
        "Installing WDF/NULL driver from %s...",
        "NPU Smart Installer application",
        "PCI\\\\VEN_1022&DEV_(1502|17F0)",
        "RtlGetVersion",
        "This is a PHX platform with MCDM installed.",
        "This is a PHX platform with WDF installed.",
        "This is a PHX platform with no driver installed.",
        "This is a STX platform with MCDM installed.",
        "This is a STX platform with WDF installed.",
        "This is a STX platform with no driver installed.",
        "Win32_OperatingSystem",
        "Windows 10 detected. Version: %lu.%lu.%lu.%lu",
        "Windows 11 MCDM OS detected. Version: %lu.%lu.%lu.%lu",
        "Windows 11 WDF OS detected. Version: %lu.%lu.%lu.%lu",
        "Windows 11 detected. Version: %lu.%lu.%lu.%lu",
        "Windows 24 detected. Version: %lu.%lu.%lu.%lu",
        "npu_mcdm_stack_prod\\kipudrv.inf",
        "npu_wdf_stack_prod\\kipudrv\\kipudrv.inf"
      ],
      "EvidenceLevel": "PayloadObserved",
      "Executed": false,
      "SafetyStatement": "AMD installer was not executed."
    }
  ],
  "DriverBinaries": [
    {
      "Path": "c0001/npu_mcdm_stack_prod/ipustack.sys",
      "Sha256": "24f8c7220b86ccb8246845c3dd25f55be4e64b2fac1aab1fbac1e1f8226d4a42",
      "ContractStatus": "ExactHashMatched",
      "ExactHashContract": {
        "ContractId": "ipustack-24f8c7220b86",
        "FileVersionObserved": "32.00.20101.3760",
        "EvidenceLevel": "StaticDisassemblyProven",
        "IdentitySemanticId": "amd-npu-ipustack-firmware-revision-v2",
        "AnalysisStatus": "Exact-hash Windows MCDM driver contract. Broad platform selection is followed, for broad values 1..4, by a secondary 1..8 revision refinement whose numeric values and labels align with upstream amdxdna AIE2 device revisions. A dedicated 0x117 command primitive is present.",
        "BroadPlatformMap": [
          {
            "value": 0,
            "label": "NPU Phoenix",
            "refinement": "None"
          },
          {
            "value": 1,
            "label": "STX Chipset NPU",
            "refinement": "FirmwareDeviceRevision"
          },
          {
            "value": 2,
            "label": "STX Chipset NPU",
            "refinement": "FirmwareDeviceRevision"
          },
          {
            "value": 3,
            "label": "STX Chipset NPU",
            "refinement": "FirmwareDeviceRevision"
          },
          {
            "value": 4,
            "label": "STX Chipset NPU",
            "refinement": "FirmwareDeviceRevision"
          },
          {
            "value": 5,
            "label": "NPU Medusa",
            "refinement": "None"
          },
          {
            "value": 6,
            "label": "NPU Soundwave",
            "refinement": "None"
          },
          {
            "value": 7,
            "label": "NPU Medusa PF",
            "refinement": "None"
          },
          {
            "value": 8,
            "label": "NPU Medusa VF",
            "refinement": "None"
          },
          {